doi,author,title,year,abstract,journal
https://doi.org/10.1515/jall.2005.26.1.99,Maarten Kossmann,"La force des choses ou l’épreuve ‘nilo-saharienne’, by Robert Nicolaï",2005,"Robert Nicolaï: La force des choses ou l’épreuve ‘nilo-saharienne’. Question sur les reconstructions archéologiques et l’évolution des langues . SUGIA Beiheft 13, Cologne: Rüdiger Köppe Verlag. 2003. 577 + xv p. EUR 64.",Journal of African Languages and Linguistics
https://doi.org/10.1515/jall.2005.26.1.103,Youni Filip Maho,"The Locative Class in Shengologa (Kgalagadi), by Sabine Neumann",2005,"Sabine Neumann: The Locative Class in Shengologa (Kgalagadi) . (Schriften zur Afrikanistik/Research in African Studies, 2.) Frankfurt am Main: Peter Lang. 1999. 240 pp. EUR 46.",Journal of African Languages and Linguistics
https://doi.org/10.1515/jall.2005.26.1.108,Christian J. Rapold,"An Anthology of Tashelhiyt Berber Folktales, by Harry Stroomer",2005,"Harry Stroomer: An Anthology of Tashelhiyt Berber Folktales . (Berber Studies, 2.) Cologne: Rüdiger Köppe, 2001. 219 pp. EUR 29.50.",Journal of African Languages and Linguistics
https://doi.org/10.1515/jall.2005.26.1.111,Thilo C. Schadeberg,"Continuity and Divergence in the Bantu Languages, by Bastin, Yvonne, André Coupez, and Michael Mann",2005,"Bastin, Yvonne, André Coupez, and Michael Mann: Continuity and Divergence in the Bantu Languages: Perspectives from a Lexicostatistic Study . (Annales, 162.) Tervuren: Musée royal de l’Afrique Centrale. 1999. 225 pp. EUR 21.07",Journal of African Languages and Linguistics
https://doi.org/10.1515/jall.2005.26.1.116,Anne Schwarz,"Studies in Buli Grammar, edited by Michael Kenstowicz and George Akanlig-Pare",2005,"Michael Kenstowicz and George Akanlig-Pare: Studies in Buli Grammar . (Working Papers on Endangered and Less Familiar Languages, Volume 4). Cambridge: Department of Linguistics, 2003. $16.",Journal of African Languages and Linguistics
https://doi.org/10.1515/jall.2004.25.2.111,Mungai Mutonya; Timothy H. Parsons,KiKAR: a Swahili variety in Kenya's colonial army,2005,"The paper discusses attitudes, identity construction, agents of linguistic change, and the outcome of dense language contact in Kenya's colonial army during the early decades of the twentieth century. The growth and development of a simplified Swahili variety in the Kenyan battalions of the King's African Rifles (KAR) during the inter-war period was influenced by the European officers' attitude towards Africans and their languages, the military's overarching desire to construct a distinct identity in the colony, and the diverse ethnolinguistic background of African soldiers. While the colonial military provided the ethnographic settings in which the new Swahili variety emerged, it was the African soldiers who were the principal agents in the restructuring and maintenance of KiKAR. The paper further illustrates the structural and lexical simplification of KiKAR based on data contained in KAR's language teaching manual: Newell's (1933) Notes on Ki-Swahili as Spoken by the K.A.R. KiKAR provides a rare glimpse into the outcome of an early contact situation involving diverse African languages and English during Swahili's pre-standardization era.",Journal of African Languages and Linguistics
https://doi.org/10.1515/jall.2004.25.2.127,Knut J. Olawsky,What is a noun? What is an adjective? Problems of classification in Dagbani,2005,"It is widely acknowledged that all languages have a class of adjectives that can be formally or functionally distinguished from other word classes. This article deals with the differences between nouns and adjectives in Dagbani, a Gur language spoken in Ghana. Remarkably, a three-way distinction is required in order to account for the different types. Specifically, Dagbani appears to have two classes whose members can take the functions typically assigned to adjectives. Their major role is to modify a noun, whereas nouns themselves cannot modify each other. The distinction between nouns and adjectives and between the two types of adjectives is based on morphological and syntactic factors: while Type A adjectives behave exactly like canonical nouns from a morphological point of view, Type B resemble loans in that they lack any kind of morphological complexity. However, on the syntactic level, Type B words are more similar to nouns than Type A are. This article investigates the relation between the three different word types and aims at an account of their classification.",Journal of African Languages and Linguistics
https://doi.org/10.1515/jall.2004.25.2.149,Martine Vanhove,‘Dire’ et finalité en bedja : Un cas de grammaticalisation,2005,"Résumé Le bedja, seule langue de la branche nord du couchitique, présente, dans la syntaxe des énoncés complexes, un phénomène de grammaticalisation largement attesté dans d'autres langues du monde : le passage d'un verbe ‘dire’, en l'occurrence un dérivé verbo-nominal, à une marque de proposition subordonnée exprimant le but ou la finalité. Cependant, cette langue ne présentant aucune des étapes intermédiaires habituellement postulées dans la chaîne de grammaticalisation, même à l'état de traces, elle conduit à s'interroger sur le caractère supposé universel de ladite chaîne. L'étude interne des procédés syntaxiques divers et récurrents pour exprimer la notion de visée au moyen du verbe ‘dire’, couplée à l'analyse du fonctionnement syntaxique du morphème grammaticalisé vont dans le sens des récentes avancées de la typologie dans ce domaine syntactico-sémantique : il existe plusieurs scénarios évolutifs qui sont liés aux systèmes syntaxiques et sémantiques des langues. Le bedja illustre l'un d'entre eux, celui où c'est le sens d'une construction qui constitue l'élément déclencheur du processus. La chaîne de grammaticalisation est bien, pour cette langue, celle d'un passage direct d'un verbe de parole à une marque de finalité.",Journal of African Languages and Linguistics
https://doi.org/10.1515/jall.2004.25.2.171,Gertie Hoyman; Zygmunt Frajzyngier; Constance Kutsch Lojenga; Lioba Moshi; David Dwyer; Reinhard Klein-Arendt; Stefan Elders,Book Reviews,2005,"Article Book Reviews was published on November 24, 2004 in the journal Journal of African Languages and Linguistics (volume 25, issue 2).",Journal of African Languages and Linguistics
https://doi.org/10.1515/jall.2004.25.2.193,Sander Steeman,Recent publications in African linguistics,2005,"Article Recent publications in African linguistics was published on November 24, 2004 in the journal Journal of African Languages and Linguistics (volume 25, issue 2).",Journal of African Languages and Linguistics
https://doi.org/10.1515/jall.22.1.1,Mahamane L Abdoulaye,The grammaticalization of Hausa zâa ‘be going’ to future,2008,"The study of the relationship between a future marker and a verb meaning ‘go’ in many languages has played a key role in the development of the grammaticalization theory (see, for example, Hopper &amp; Traugott 1993). This paper claims that the Hausa zâa / zaa -future developed out of a non-continuative form of the verb zâa , which is inherently inchoative and means ‘start to go, be going’. The paper compares the purposive and the future constructions and lays out the grammaticalization stages of the zâa / zaa -future in various dialects of Hausa. Despite its particularity, the Hausa case turns out to be a clear confirmation of the adequacy of the most important grammaticalization concepts in handling variations in a language or across its dialects.",Journal of African Languages and Linguistics
https://doi.org/10.1515/jall.22.1.33,Cynthia L Miller; Leoma G Gilley,Evidence for Ergativity in Shilluk,2008,"Shilluk, a Northwestern Nilotic language of the Luwo subgroup, has not previously been described as ergative. Using the framework of Dixon (1994), we examine ergative features in Shilluk on the morphological, as well as syntactic, level. Features of morphological ergativity examined include constituent order, constituent marking, pronominal indices, cross-referencing on the verb, the antipassive, and omissibility of arguments. After reviewing these features in independent, non-sequential clauses, we examine them in three types of sequential/dependent clauses. Shilluk proves to be thoroughly ergative in independent clauses, but some ergative features are neutralised in sequential or dependent clauses. The recognition of Shilluk as morphologically ergative is particularly important in light of previous descriptions of the basic ergative sentence as passive. Finally, we consider the ways in which Shilluk is, and is not, syntactically ergative. Although Shilluk is essentially pivotless in coordinate clauses, pronominal reference exhibits minor features of a nominative-accusative system.",Journal of African Languages and Linguistics
https://doi.org/10.1515/jall.22.1.69,Nicolas Quint,Vowels as a morphological tool in Santiago Creole Portuguese (Cape Verde),2008,"In Cape Verde, the Afro-Portuguese Creole of the island of Santiago, the so-called Badew, displays many contrastive verb-noun pairs in which the verb is characterized by a mid-open vowel, and the noun by an open one. The origin of this phenomenon has a historical explanation, in this case a stress-shift (from the last-syllable to the penultimate one) of the verb-word (derived from the oxytonic Portuguese infinitive), due to a dominant /'CVCV/ pattern in Badew. Nevertheless, in modern Badew, diachrony does not account for all the verb-noun pairs based on the opposition between mid-open and open vowels. This opposition has become a morphological device that enables Badew to derive new nouns from verbs and vice-versa. Considering the fact that Badew is a Creole language, the appearance of this new derivational system, inexistant in Portuguese, the lexifier language, could have been favored by the necessity of compensating for the failures and ambiguities of a poor vocabulary inherited from the pidgin stage of the language.",Journal of African Languages and Linguistics
https://doi.org/10.1515/jall.2000.21.2.123,JEAN ALAIN BLANCHON,Bipartition des noms polysyllabiques réflexes du type tonal *BH dans les zones B.40 et H.12,2009,"Article Bipartition des noms polysyllabiques réflexes du type tonal *BH dans les zones B.40 et H.12 was published on January 1, 2000 in the journal Journal of African Languages and Linguistics (volume 21, issue 2).",Journal of African Languages and Linguistics
https://doi.org/10.1515/jall.2000.21.2.135,ROSS JONES,Coreference marking in Boko - Logophoricity or not?,2009,"Article Coreference marking in Boko - Logophoricity or not? was published on January 1, 2000 in the journal Journal of African Languages and Linguistics (volume 21, issue 2).",Journal of African Languages and Linguistics
https://doi.org/10.1515/jall.2000.21.2.161,JOHN M. STEWART,An explanation of Bantu vowel height harmony in terms of a Pre-Bantu nasalized vowel lowering,2009,"Article An explanation of Bantu vowel height harmony in terms of a Pre-Bantu nasalized vowel lowering was published on January 1, 2000 in the journal Journal of African Languages and Linguistics (volume 21, issue 2).",Journal of African Languages and Linguistics
https://doi.org/10.1515/jall.2000.21.1.1,BIRGIT HELLWIG; JOSEPH A. MCINTYRE,Hausa plural Systems: a diachronic presentation,2009,"Article Hausa plural Systems: a diachronic presentation was published on January 1, 2000 in the journal Journal of African Languages and Linguistics (volume 21, issue 1).",Journal of African Languages and Linguistics
https://doi.org/10.1515/jall.2000.21.1.45,DAVID ODDEN,The phrasal tonology of Zinza,2009,"Article The phrasal tonology of Zinza was published on January 1, 2000 in the journal Journal of African Languages and Linguistics (volume 21, issue 1).",Journal of African Languages and Linguistics
https://doi.org/10.1515/jall.1999.20.2.97,TORBEN ANDERSEN,Vowel quality alternation in Mabaan and its Western Nilotic history,2009,"Article Vowel quality alternation in Mabaan and its Western Nilotic history was published on January 1, 1999 in the journal Journal of African Languages and Linguistics (volume 20, issue 2).",Journal of African Languages and Linguistics
https://doi.org/10.1515/jall.1999.20.2.121,THOMAS BEARTH,The contribution of African linguistics towards a general theory of focus. Update and critical review,2009,"Article The contribution of African linguistics towards a general theory of focus. Update and critical review was published on January 1, 1999 in the journal Journal of African Languages and Linguistics (volume 20, issue 2).",Journal of African Languages and Linguistics
https://doi.org/10.1515/jall.1999.20.2.157,TOM GÜLDEMANN,Toward a grammaticalization and typological account of the ka-possessive in southern Nguni,2009,"Article Toward a grammaticalization and typological account of the ka-possessive in southern Nguni was published on January 1, 1999 in the journal Journal of African Languages and Linguistics (volume 20, issue 2).",Journal of African Languages and Linguistics
https://doi.org/10.1515/jall.1999.20.1.1,WALTER BISANG; REMI SONAIYA,The functional motivation of the High Tone Syllable in Yoruba,2009,"Article The functional motivation of the High Tone Syllable in Yoruba was published on January 1, 1999 in the journal Journal of African Languages and Linguistics (volume 20, issue 1).",Journal of African Languages and Linguistics
https://doi.org/10.1515/jall.1999.20.1.21,MICHAEL CAHILL,Diphthongization in Konni: A Feature Geometry Account,2009,"Article Diphthongization in Konni: A Feature Geometry Account was published on January 1, 1999 in the journal Journal of African Languages and Linguistics (volume 20, issue 1).",Journal of African Languages and Linguistics
https://doi.org/10.1515/jall.1999.20.1.41,KATHERINE DEMUTH; CAROLYN HARFORD,Verb raising and subject inversion in Bantu relatives,2009,"Article Verb raising and subject inversion in Bantu relatives was published on January 1, 1999 in the journal Journal of African Languages and Linguistics (volume 20, issue 1).",Journal of African Languages and Linguistics
https://doi.org/10.1515/jall.1998.19.2.93,RICHARD J. HAYWARD,The origins of the North Ometo verb agreement systems,2009,"Article The origins of the North Ometo verb agreement systems was published on January 1, 1998 in the journal Journal of African Languages and Linguistics (volume 19, issue 2).",Journal of African Languages and Linguistics
https://doi.org/10.1515/jall.1998.19.2.113,JOYCE T. MATHANGWANE,Aspirates: Their development and depression in Ikalanga,2009,"Article Aspirates: Their development and depression in Ikalanga was published on January 1, 1998 in the journal Journal of African Languages and Linguistics (volume 19, issue 2).",Journal of African Languages and Linguistics
https://doi.org/10.1515/jall.1998.19.2.137,LIOBA MOSHI,Word order in multiple object constructions in KiVunjo-Chaga,2009,"Article Word order in multiple object constructions in KiVunjo-Chaga was published on January 1, 1998 in the journal Journal of African Languages and Linguistics (volume 19, issue 2).",Journal of African Languages and Linguistics
https://doi.org/10.1515/jall.1998.19.1.1,MARIE K. HUFFMAN; THOMAS J. HINNEBUSCH,The phonetic nature of “voiceless” nasals in Pokomo: Implications for sound change,2009,"Article The phonetic nature of “voiceless” nasals in Pokomo: Implications for sound change was published on January 1, 1998 in the journal Journal of African Languages and Linguistics (volume 19, issue 1).",Journal of African Languages and Linguistics
https://doi.org/10.1515/jall.1998.19.1.21,E. KWEKU OSAM,Complementation in Akan,2009,"Article Complementation in Akan was published on January 1, 1998 in the journal Journal of African Languages and Linguistics (volume 19, issue 1).",Journal of African Languages and Linguistics
https://doi.org/10.1515/jall.1997.18.2.129,JEAN ALAIN BLANCHON,Les formes nominales de citation à préfixe haut en pounou (Bantou B43),2009,"Article Les formes nominales de citation à préfixe haut en pounou (Bantou B43) was published on January 1, 1997 in the journal Journal of African Languages and Linguistics (volume 18, issue 2).",Journal of African Languages and Linguistics
https://doi.org/10.1515/jall.1997.18.2.139,HENDRIK J. KOCKAERT,Vowel harmony in siSwati: An experimental study of raised and non-raised vowels,2009,"Article Vowel harmony in siSwati: An experimental study of raised and non-raised vowels was published on January 1, 1997 in the journal Journal of African Languages and Linguistics (volume 18, issue 2).",Journal of African Languages and Linguistics
https://doi.org/10.1515/jall.1997.18.2.157,ANNE STORCH,Where have all the noun classes gone? A case study of Jukun,2009,"Article Where have all the noun classes gone? A case study of Jukun was published on January 1, 1997 in the journal Journal of African Languages and Linguistics (volume 18, issue 2).",Journal of African Languages and Linguistics
https://doi.org/10.1515/jall.1997.18.1.1,KATHERINE DEMUTH; SHEILA MMUSI,Presentational focus and thematic structure in comparative Bantu,2009,"Article Presentational focus and thematic structure in comparative Bantu was published on January 1, 1997 in the journal Journal of African Languages and Linguistics (volume 18, issue 1).",Journal of African Languages and Linguistics
https://doi.org/10.1515/jall.1997.18.1.21,ANTHONY TRAILL; RAINER VOSSEN,Sound change in the Khoisan languages: new data on click loss and click replacement,2009,"Article Sound change in the Khoisan languages: new data on click loss and click replacement was published on January 1, 1997 in the journal Journal of African Languages and Linguistics (volume 18, issue 1).",Journal of African Languages and Linguistics
https://doi.org/10.1515/jall.1996.17.2.113,MAHAMANE L. ABDOULAYE,Efferential „verb + dà“ constructions in Hausa,2009,"Article Efferential „verb + dà“ constructions in Hausa was published on January 1, 1996 in the journal Journal of African Languages and Linguistics (volume 17, issue 2).",Journal of African Languages and Linguistics
https://doi.org/10.1515/jall.1996.17.2.153,M. E. KROPP DAKUBU,Explaining Ga plurals,2009,"Article Explaining Ga plurals was published on January 1, 1996 in the journal Journal of African Languages and Linguistics (volume 17, issue 2).",Journal of African Languages and Linguistics
https://doi.org/10.1515/jall.1995.16.2.115,'MALILLO 'MATSEPO MACHOBANE,The Sesotho locative constructions,2009,"Article The Sesotho locative constructions was published on January 1, 1995 in the journal Journal of African Languages and Linguistics (volume 16, issue 2).",Journal of African Languages and Linguistics
https://doi.org/10.1515/jall.1995.16.2.137,KATHLEEN HUBBARD,Morification and syllabification in Bantu languages,2009,"Article Morification and syllabification in Bantu languages was published on January 1, 1995 in the journal Journal of African Languages and Linguistics (volume 16, issue 2).",Journal of African Languages and Linguistics
https://doi.org/10.1515/jall.1995.16.2.157,MOGES YIGEZU,The Nuer vowel system,2009,"Article The Nuer vowel system was published on January 1, 1995 in the journal Journal of African Languages and Linguistics (volume 16, issue 2).",Journal of African Languages and Linguistics
https://doi.org/10.1515/jall.1995.16.2.171,DIDIER L. GOYVAERTS,Review article: Codeswitching: The African connection,2009,"Article Review article: Codeswitching: The African connection was published on January 1, 1995 in the journal Journal of African Languages and Linguistics (volume 16, issue 2).",Journal of African Languages and Linguistics
https://doi.org/10.1515/jall.1995.16.1.3,LARRY M. HYMAN,Minimality and the prosodic morphology of Cibemba imbrication,2009,"Article Minimality and the prosodic morphology of Cibemba imbrication was published on January 1, 1995 in the journal Journal of African Languages and Linguistics (volume 16, issue 1).",Journal of African Languages and Linguistics
https://doi.org/10.1515/jall.1995.16.1.41,BRUCE CONNELL,The historical development of Lower Cross consonants,2009,"Article The historical development of Lower Cross consonants was published on January 1, 1995 in the journal Journal of African Languages and Linguistics (volume 16, issue 1).",Journal of African Languages and Linguistics
https://doi.org/10.1515/jall.1995.16.1.71,MAARTEN GOSLING KOSSMANN,Schwa en berbère,2009,"Article Schwa en berbère was published on January 1, 1995 in the journal Journal of African Languages and Linguistics (volume 16, issue 1).",Journal of African Languages and Linguistics
https://doi.org/10.1515/jall.1994.15.2.113,CHRISTOPHER CULY,A note on logophoricity in Dogon,2009,"Article A note on logophoricity in Dogon was published on January 1, 1994 in the journal Journal of African Languages and Linguistics (volume 15, issue 2).",Journal of African Languages and Linguistics
https://doi.org/10.1515/jall.1994.15.2.127,LIOBA MOSHI,Time reference markers in KiVunjo-Chaga,2009,"Article Time reference markers in KiVunjo-Chaga was published on January 1, 1994 in the journal Journal of African Languages and Linguistics (volume 15, issue 2).",Journal of African Languages and Linguistics
https://doi.org/10.1515/jall.1994.15.2.161,A. TRAILL,The perception of clicks in !Xóõ,2009,"Article The perception of clicks in !Xóõ was published on January 1, 1994 in the journal Journal of African Languages and Linguistics (volume 15, issue 2).",Journal of African Languages and Linguistics
https://doi.org/10.1515/jall.1994.15.2.175,JOHN M. STEWART,Review article: The comparative phonology of Gbe and its significance for that of Kwa and Volta-Congo,2009,"Article Review article: The comparative phonology of Gbe and its significance for that of Kwa and Volta-Congo was published on January 1, 1994 in the journal Journal of African Languages and Linguistics (volume 15, issue 2).",Journal of African Languages and Linguistics
https://doi.org/10.1515/jall.1994.15.1.7,SUANU M. IKORO,Numeral classifiers in Kana,2009,"Article Numeral classifiers in Kana was published on January 1, 1994 in the journal Journal of African Languages and Linguistics (volume 15, issue 1).",Journal of African Languages and Linguistics
https://doi.org/10.1515/jall.1994.15.1.29,DAVID J. DWYER,Infernal evidence for tone Splitting in Bobo,2009,"Article Infernal evidence for tone Splitting in Bobo was published on January 1, 1994 in the journal Journal of African Languages and Linguistics (volume 15, issue 1).",Journal of African Languages and Linguistics
https://doi.org/10.1515/jall.1993.14.2.107,DENIS CREISSELS; CLAIRE GRÉGOIRE,La notion de ton marqué dans l’analyse d’une opposition tonale binaire: Le cas du mandingue,2009,"Article La notion de ton marqué dans l’analyse d’une opposition tonale binaire: Le cas du mandingue was published on January 1, 1993 in the journal Journal of African Languages and Linguistics (volume 14, issue 2).",Journal of African Languages and Linguistics
https://doi.org/10.1515/jall.1993.14.2.155,AĻI ALALOU and; PATRICK FARRELL,Argument structure and causativization in Tamazight Berber,2009,"Article Argument structure and causativization in Tamazight Berber was published on January 1, 1993 in the journal Journal of African Languages and Linguistics (volume 14, issue 2).",Journal of African Languages and Linguistics
https://doi.org/10.1515/jall.1993.14.2.187,ROBERT BOTNE,Noun incorporation into verbs: The curious case of ‘ground’ in Bantu,2009,"Article Noun incorporation into verbs: The curious case of ‘ground’ in Bantu was published on January 1, 1993 in the journal Journal of African Languages and Linguistics (volume 14, issue 2).",Journal of African Languages and Linguistics
https://doi.org/10.1515/jall.1993.14.1.5,SAM A. MCHOMBO,A formal analysis of the stative construction in Bantu,2009,"Article A formal analysis of the stative construction in Bantu was published on January 1, 1993 in the journal Journal of African Languages and Linguistics (volume 14, issue 1).",Journal of African Languages and Linguistics
https://doi.org/10.1515/jall.1993.14.1.29,KAY WILLIAMSON,The noun prefixes of New Benue-Congo,2009,"Article The noun prefixes of New Benue-Congo was published on January 1, 1993 in the journal Journal of African Languages and Linguistics (volume 14, issue 1).",Journal of African Languages and Linguistics
https://doi.org/10.1515/jall.1993.14.1.47,GROVER HUDSON,Evidence of an argot for Amharic and theoretical phonology,2009,"Article Evidence of an argot for Amharic and theoretical phonology was published on January 1, 1993 in the journal Journal of African Languages and Linguistics (volume 14, issue 1).",Journal of African Languages and Linguistics
https://doi.org/10.1515/jall.1992.13.2.125,FRANÇOIS DELL; OUFAE TANGI,Syllabification and Empty Nuclei in Ath-Sidhar Rifian Berber,2009,"Article Syllabification and Empty Nuclei in Ath-Sidhar Rifian Berber was published on January 1, 1992 in the journal Journal of African Languages and Linguistics (volume 13, issue 2).",Journal of African Languages and Linguistics
https://doi.org/10.1515/jall.1992.13.2.163,MANFRED VON RONCADOR,Types of Logophoric Marking in African Languages,2009,"Article Types of Logophoric Marking in African Languages was published on January 1, 1992 in the journal Journal of African Languages and Linguistics (volume 13, issue 2).",Journal of African Languages and Linguistics
