doi,author,title,year,abstract,journal
https://doi.org/10.1515/jall-2013-0002,Fusheini Hudu,"Dagbani tongue-root harmony: triggers, targets and blockers",2013,"This paper describes advanced tongue-root [ATR] harmony in Dagbani, a Gur language of Ghana, focusing on three distinct segments: triggers, targets, and blockers of [+ATR] harmony. Dagbani has a bidirectional [ATR] harmony, with [+ATR] as the dominant value. A root [i] triggers a left-to-right harmony targeting vowels in suffixes and clitics while the mid vowels [e, o] trigger a right-to-left direction of harmony targeting root vowels. There are two restrictions on harmony. First, a height similarity condition restricts harmony to a trigger and target that are both [+high] or [−high]. Second, a class of opaque consonants [l, ɾ, s] block the spread of [+ATR] between /i/ and an eligible vowel target. However, the opacity is unidirectional as the coronals do not block a right-to-left harmony. The paper addresses the controversy on whether such opacity effects exist in harmony patterns and discusses other issues of general theoretical interest in harmony patterns, such as parasitic harmony and the position of low vowels in [ATR] harmony.",Journal of African Languages and Linguistics
https://doi.org/10.1515/jall-2013-0003,Seth Antwi Ofori,A prosodic analysis of monosyllabic and disyllabic verb reduplication in Twi (Akan),2013,"This paper argues that, in Twi (Akan), the shape of a reduplicant, and the resulting segmental processes and reduplicated output are largely determined by its input's inherent tone and the ‘strength’ of its syllables; an argument in support of Mophological Doubling Theory (MDT) (Inkelas and Zoll 2005) within which the reduplicant like its base has access to the input. This observation led to the classification of disyllabic verb inputs into two: a low-toned group with a contrastive, and a non-contrastive, syllable; and, a low-high-toned group with two contrastive syllables. Non-contrastive syllables are banned from the reduplicant, which is why reduplicants of the former group are monosyllabic, and, respect *[−High] (McCarthy and Prince 1995) just like monosyllabic verbs' reduplicants. Their final segment(s) are unparsed, and are deleted without compensatory lengthening, except in cases where the final segment becomes homorganic with the following consonant. The latter group's reduplicants are disyllabic with every segment parsed; homorganic assimilation of the reduplicant-final segment applies optionally; and, with the loss of (a) reduplicant-final segment(s), vowel lengthening applies to avoid a monosyllabic reduplicant and, consequently, *[−High]. *[−High] applies to distinguish outputs of the former group from outputs of monosyllabic/disyllabic adjectives. The ranking argument, *Contour ≫ Align LH ≫ Tone Polarity ≫ Tone Spread, derives output tones.",Journal of African Languages and Linguistics
https://doi.org/10.1515/jall-2013-0004,William J. Samarin,Versions of Kituba's origin: Historiography and theory,2013,"Casual explanations and thoughtful ones have been given for the emergence of Kituba, one of the African-based lingua francas of West Central Africa, but there is still no scholarly work that is based on political, historical, anthropological, and linguistic research to account for the language's origin and development. The present contribution is, first, an overview of various attempts at explaining its origin and development. Second, argued and arguable explanations are examined from different perspectives and with data not available before recent research. Finally, the author adds Kituba to his list of African vehicular languages that emerged in the late 19 th century, when a significant number of auxiliaries – Africans in the majority, foreign and indigenous ones – solved their communication needs by contriving make-shift idioms that quickly gelled as languages. Still far from the work that will hopefully be accomplished by others, this modest study suggests the kind of historiography and linguistic analysis that will helpfully characterize it.",Journal of African Languages and Linguistics
https://doi.org/10.1515/jall-2013-0005,Saskia van Putten; Lameen Souag,Book Reviews,2013,"Article Book Reviews was published on May 10, 2013 in the journal Journal of African Languages and Linguistics (volume 34, issue 1).",Journal of African Languages and Linguistics
https://doi.org/10.1515/jall-2012-0007,Torben Andersen,Spatial roles and verbal directionality in Dinka,2012,"This article deals with the interaction between two subsystems of the grammar of Dinka, a Western Nilotic language: (i) the semantic role of a place adverbial as location, source or goal, and (ii) deictic directionality expressed in the verb. Some place adverbials do not encode the distinction between the three spatial roles, but some nouns and some complex noun phrases distinguish between an allative case, which encodes a goal, and an essive/ablative case, which encodes either a location or a source. The derivational morphology of verbs includes a distinction between direction towards the deictic centre (centripetal) and direction not towards the deictic centre (centrifugal). There are constraints on the combinability between a place adverbial with a given semantic role and a verb with a given derivational status. Thus, a goal adverbial requires either a centrifugal verb or a centripetal verb. In clauses with a single place adverbial, moreover, a source adverbial requires either a non-directional verb or a centripetal verb, and a location adverbial requires a non-directional verb.",Journal of African Languages and Linguistics
https://doi.org/10.1515/jall-2012-0008,Lameen Souag,The subclassification of Songhay and its historical implications,2012,"This paper seeks to establish the first cladistic subgrouping of Songhay explicitly based on shared arbitrary innovations, a prerequisite both for distinguishing recent loans from valid extra-Songhay comparanda and for determining how Songhay spread. The results indicate that the Northern Songhay languages of the Sahara form a valid subfamily, even though no known historical records link Tabelbala to the others, and that Northern Songhay and Western Songhay (spoken around Timbuktu and Djenné) together form a valid subfamily, Northwestern Songhay. The speakers of Proto-Northern Songhay practised cultivation and permanent architecture, but were unfamiliar with date palms. Proto-Northwestern Songhay was already in contact with Berber and probably (perhaps indirectly) with Arabic, and was spoken along the Niger River. Proto-Songhay itself appears likely to have been in contact with Gur languages, confirming its relatively southerly location. This result is compatible with two scenarios for the northerly spread of Songhay. On Hypothesis A, Northern Songhay spread out from an oasis north-east of Gao, probably Tadmakkat or Takedda, and Northwestern Songhay had been spoken in areas west of Gao which now speak Eastern Songhay. On Hypothesis B, Northern Songhay spread out from the Timbuktu region, and Western Songhay derives from heavy “de-creolising” influence by Eastern Songhay on an originally Northern Songhay language. To choose between these hypotheses, further fieldwork will be required.",Journal of African Languages and Linguistics
https://doi.org/10.1515/jall-2012-0009,Yvonne Treis,Categorial hybrids in Kambaata,2012,"The paper discusses three categorial hybrids in the East Cushitic language Kambaata, viz. negative participles, agent adjectives and verbal nouns, all of which are shown to combine properties of two word classes (lexical categories) systematically. Unlike their affirmative counterparts, Kambaata negative relative verbs qualify as verbal adjectives (participles), because, apart from having verbal inflectional morphology and a completely verbal argument structure, they have also acquired adjectival morphology to indicate case/gender agreement with their head nouns. The combination of verbal and adjectival features is less balanced for agent adjectives, which retain fewer properties of the verbs they are based on; however, they are still able to govern objects and be modified by adverbial clauses. Kambaata verbal nouns behave almost entirely like verbs in relation to their dependents but as nouns with respect to the clause where they feature as arguments. I argue that the negative participle formation and the verbal noun formation are inflectional processes which change the word form word class from verb to adjective and verb to noun, respectively, but which preserve the properties of the lexeme word class (Verb). In contrast, the agent adjective formation is analysed as a derivational process with a greater impact on the lexeme word class.",Journal of African Languages and Linguistics
https://doi.org/10.1515/jall-2012-0001,"Leston Chandler Buell,",Class 17 as a non-locative noun class in Zulu,2012,"Bantu noun class 17 is locative both historically and in many modern languages. However, in Zulu, certain uses of class 17 are clearly non-locative. For example, class 17 demonstrative pronouns can refer to situations but not to places, while the class 17 subject marker is used when the preverbal subject is a conjunction of unlike classes. This paper explores the uses of class 17, to evaluate the traditional notion of its locative nature in Zulu. Syntactic analyses are given of the many constructions in which the class 17 subject marker appears, including inversions and non-verbal existential predication. It is shown that the unusual agreement pattern in copular constructions is due to agreement with a non-expletive class 17 pro, mirroring a pattern found in French and Dutch. The paper concludes that class 17 is essentially non-locative in Zulu, by arguing that the supposed locative properties can be attributed either to accidental class membership or to the fact that items historically related to class 17 lie outside the modern noun class paradigm.",Journal of African Languages and Linguistics
https://doi.org/10.1515/jall-2012-0002,"Klaudia Dombrowsky-Hahn,",Motion events in Bambara (Mande),2012,"The paper analyses motion events in the Mande language Bambara, using the theoretical framework developed by Croft et al. (2010), which is a revision of the theory first proposed by Talmy (1975, 1985). The revision of Talmy's theory on the semantics and syntax of motion events introduces a distinction between symmetrical and asymmetrical constructions and proposes to apply it to individual constructions and not to entire languages. In Bambara we find two different types of constructions both of which are asymmetrical: verb framing and satellite framing constructions. The verb framing construction expresses the path of motion in a finite verb, whereas manner of motion is encoded in an adverbial form or copredicative form, which is derived by means of -tɔ or -bagatɔ . The adverbial form precedes the finite form of the verb. The second type is a satellite framing construction where the manner of motion is expressed in a finite verb form and the path of motion by means of an infinitive form of the verb introduced by the morpheme kà . Some of the path verbs in the language have developed into prepositions together with the infinitive morpheme kà . Although this allows characterizing them as satellite framing, there are some features that set them apart from satellite framing constructions in languages like English, German or Polish. The first feature is that even those path verbs that develop into prepositions continue to function as full verbs in the language with no tendency to lose this function. The second distinguishing feature is the possibility of combining several path verbs in one clause. These features make Bambara resemble languages that have serial verb constructions, which belong to symmetrical constructions according to Croft et al. (2010).",Journal of African Languages and Linguistics
https://doi.org/10.1515/jall-2012-0003,"Birgit Hellwig,",Lexicalization of property concepts: Evidence for language contact on the southern Jos Plateau (Central Nigeria)?,2012,"This paper discusses issues of language contact within the Jos Plateau sprachbund of Central Nigeria. It is known that the non-related Chadic and Benue-Congo languages of this region share numerous lexical and structural similarities, but it is largely unknown whether they also share similarities in their semantics and lexicalization patterns. This paper explores convergences in one such area: the lexicalization of property — or adjectival — concepts in the Chadic (Angas-Goemai and Ron groups) and Benue-Congo (Jukunoid, Tarok and Fyem) languages of the southern part of this sprachbund . It presents evidence that these non-related languages share a common lexicalization pattern: the predominant coding of property concepts in state-change verbs. This pattern is probably not of Chadic origin, and it is possible that it has entered the Chadic languages of the Jos Plateau through language contact.",Journal of African Languages and Linguistics
https://doi.org/10.1515/jall-2012-0004,"Larry M. Hyman,",Post-Verbal subject in the Nzadi relative clause,2012,"This paper addresses a curious condition on non-subject relative clauses (NSRCs) in Nzadi, a previously unstudied B.80 Bantu language spoken in the Democratic Republic of the Congo. While a number of other Bantu languages allow or require the subject of an NSRC to occur after the verb, what makes Nzadi different from these languages is that when the full noun phrase subject optionally occurs before the verb, the verb must be followed by a co-referential pronominal recapitulative pronoun (‘the child that the woman saw she’). The present study documents this phenomenon in some detail and draws parallels with recapitulative post-verbal subject pronouns in both NSRCs and negative constructions in other Bantu languages.",Journal of African Languages and Linguistics
https://doi.org/10.1515/jall.2011.007,Koen Bostoen; Léon Mundeke,"The causative/applicative syncretism in Mbuun (Bantu B87, DRC): Semantic split or phonemic merger?",2011,"In Mbuun (B87), a Bantu language spoken in the Bandundu Province of the Democratic Republic of the Congo, the valency-increasing functions of the causative and the applicative have, to a certain extent, the same formal expression. They are encoded morphologically by a derivational suffix which has an uncharacteristic morphophonological realization. It triggers the gemination of the root-final consonant. In this paper, we examine whether this causative/applicative isomorphism is the result of a semantic split or rather the outcome of a phonemic merger. In the first case, the semantic extension must have happened from applicative to causative rather than the cross-linguistically more common evolution from causative to applicative, since the consonant gemination associated with these forms has its origin in the Proto-Bantu applicative suffix * - i d- . In the case of a phonemic merger, however, this applicative suffix would have become homophonous with an originally distinct suffix having a causative effect as the result of convergent morphophonological change. This morpheme cannot be the Proto-Bantu causative suffix * -ici- , which still has a residual causative use in Mbuun.",Journal of African Languages and Linguistics
https://doi.org/10.1515/jall.2011.008,Rose Letsholo,The syntactic distribution of argument and adjunct question word constructions in Ikalanga,2011,"This paper investigates the distribution of argument and adjunct question phrases in Ikalanga. It is argued that both adjunct and argument question phrases in this language are focused, but that the former are merged in the specifier of a focus phrase (which projects either within v P or higher than TP) while argument question phrases occur in the specifier of a focus phrase as a result of a syntactic operation, namely attract . Evidence that adjunct question phrases are base generated in spec-FocP rather than moved there while argument question phrases are moved to spec-FocP comes from morphological differences observed between the two construction types as well as movement tests. There are two main points of interest related to the distribution of adjunct question phrases. One has to do with the fact that Ikalanga has one word chini which means ‘how’ or ‘how come’. The paper argues that speakers distinguish chini ‘how’ and ‘how come’ based on their syntactic distribution, which is complementary. chini ‘how come’ is always merged in the specifier of FocP and can occur either on the left edge of the sentence or on the right edge of the sentence. chini ‘how’ on the other hand only occurs at the right edge of the sentence or between the verb and its complement. It is shown that although chini ‘how come’ seemingly occurs on the right edge of the sentence, this is a derived position: it is a position that results after a proposition, a TP, has been topicalized leaving behind chini in spec-FocP. The second point of interest concerning the distribution of adjuncts is the rather unusual position they occupy, namely between the verb and its complement. The paper proposes that these data can be analyzed successfully by adopting the proposal that a focus phrase projects within v P (see Ndayiregige, Linguistic Inquiry 30: 399–444, 1999, van der Wal, The disjoint verb form and an empty immediate after verb position, ZAS, 2006, among others, for similar proposals.",Journal of African Languages and Linguistics
https://doi.org/10.1515/jall.2011.009,Tatiana Nikitina,Categorial reanalysis and the origin of the S-O-V-X word order in Mande,2011,"Mande languages are characterized by a typologically unusual rigid S-O-V-X word order pattern, and do not fit neatly into the traditional category of “verb-final” languages. While subjects and objects precede the verb, all oblique arguments and adjuncts follow it. Several diachronic hypotheses have been advanced to account for the word order type of Mande (Givón, Serial verbs and syntactic change: Niger-Congo, University of Texas Press, 1975, Heine and Reh, Grammaticalization and reanalysis in African languages, Helmut Buske, 1984, Claudi, Die Stellung von Verb und Objekt in Niger-Kongo-Sprachen: Ein Beitrag zur Rekonstruktion historischer Syntax, Universität zu Köln, 1993), none of which are fully satisfactory. This paper discusses new evidence from the syntax of modern Mande languages that may shed light on the historical development of the S-O-V-X word order. I argue, based on the unusual behavior of Mande postpositional phrases, that the development of S-O-V-X was a consequence of categorial reanalysis of constructions with deverbal nouns as verb phrases, with subsequent replacement of the older type of verb phrase by the newly introduced structure. The analysis is supported by a number of characteristic parallels between the syntax of Mande verb phrases and noun phrases, such as the absence, in some languages, of both verb-phrase-internal and noun-phrase-internal postpositional phrases, the absence of the genitive vs. accusative distinction, and identical restrictions on the number of complements of nouns and verbs.",Journal of African Languages and Linguistics
https://doi.org/10.1515/jall.2011.010,Rolf Theil,Koorete segmental phonology,2011,"An analysis of the segmental phonology of Koorete ( kòorete ) is presented, with sections on vowels, consonants, and consonant clusters. The analysis differs from earlier ones (Hayward, Afrika und Übersee LXV: 211–268, 1982, Ford, Notes on Ko:rete phonology, School of Oriental and African Studies, University of London, 1990) by claiming that diphthongs constitute an important part of Koorete phonology, that Koorete has no distinctive opposition between affricates and fricatives, and that there are distinctive oppositions between single and geminated sibilants in consonant clusters. There are also shorter sections on aspects of Koorete tonology and morphophonology.",Journal of African Languages and Linguistics
https://doi.org/10.1515/jall.2011.011,Gabriele Sommer,"Language Contact, Language Change and History Based on Language Sources in Africa, edited by Wilhelm J.G. Möhlig, Seidel, Frank and Marc Seifert",2011,"Article Language Contact, Language Change and History Based on Language Sources in Africa, edited by Wilhelm J.G. Möhlig, Seidel, Frank and Marc Seifert was published on September 1, 2011 in the journal Journal of African Languages and Linguistics (volume 32, issue 2).",Journal of African Languages and Linguistics
https://doi.org/10.1515/jall.2011.001,Mahamane L. Abdoulaye,Relative clauses in Hausa: A grammaticalization perspective,2011,"This paper claims that relative clauses in Hausa originate from adverbial scene setting clauses. The scene setting clauses (SSCs) are causal, reason, or circumstantial clauses that evoke known, presupposed information and serve as background to their main clauses. When positioned after a sentence topic, they can shift formally and functionally from clause level to NP level modification and give rise to relative clauses in appropriate contexts. Taking advantage of Role and Reference Grammar's proposed functional and structural similarities between NP and clause modifiers, this paper also gives a representation for various relative constructions in Hausa.",Journal of African Languages and Linguistics
https://doi.org/10.1515/jall.2011.002,Beban Sammy Chumbow; Ayu'nwi N. Neba,Tone raising and tone lowering in Bafut,2011,"While a lot has been said about H tone lowering after a L tone in Bafut, L tone raising before a non-L tone remains a less studied phenomenon. This paper seeks to describe these two tone phenomena in the language, which result from two phonologically contrastive pitch levels. Our findings are that in addition to the better known H tone lowering, there also exists L tone raising and the apparent complexity of the two phenomena is best understood in terms of the involvement of the interaction of tone features. We argue that the data are best analysed within a theory that recognises a register tier (Snider, The geometry and features of tone, Summer Institute of Linguistics and University of Texas at Arlington, 1999).",Journal of African Languages and Linguistics
https://doi.org/10.1515/jall.2011.003,Laura J. Downing; Al Mtenje,Prosodic phrasing of Chichewa relative clauses,2011,"Earlier studies of Chichewa phrasal prosody – Kanerva (Focus and phrasing in Chichewa phonology, Garland, 1990) and Truckenbrodt (Phonological phrases: Their relation to syntax, focus and prominence, MIT, 1995, Linguistic Inquiry 30: 219–255, 1999, Linguistische Berichte 203: 273–296, 2005) – claim that Phonological Phrases in this language can potentially be quite large, as an entire maximal syntactic constituent – for example, a verb and all its complements – is parsed into a single Phonological Phrase in their analysis. This proposal predicts that even long and internally complex syntactic constituents will be parsed into a single Phonological Phrase. Relative clause constructions provide the ideal context for testing the proposal. However, neither Kanerva's (Focus and phrasing in Chichewa phonology, Garland, 1990) study of Chichewa prosodic phrasing nor Watkins's (A grammar of Chichewa: A Bantu language of British Central Africa, University of Chicago, 1937) and Mchombo's (The syntax of Chichewa, Cambridge University Press, 2004) grammars include sufficient examples to get a complete picture of their prosodic properties. Our study first presents a survey of prosodic phrasing in four relative clause constructions, then it provides an optimality theory (OT) analysis of the data. We show that Truckenbrodt's (Phonological phrases: Their relation to syntax, focus and prominence, MIT, 1995) OT analysis must be revised to account for the correlation we find in this data between syntactic phase edges and prosodic phrasing. Following work like Chen (Phonology Yearbook 4: 109–149, 1987), we show that the complement/adjunct distinction is an additional factor conditioning prosodic phrasing.",Journal of African Languages and Linguistics
https://doi.org/10.1515/jall.2011.004,Mark Van de Velde; Odette Ambouroue,The grammar of Orungu proper names,2011,"Aspects of the grammar of proper names in the Gabonese Bantu language Orungu are described and tentatively explained, with special attention for agreement and definiteness marking. Proper names have a mixed agreement pattern that differs from that of the common nouns with which they are related. Definiteness marking is redundant on proper names, which are inherently definite. The difference between definite and non-definite tone patterns is deployed to express other semantic-pragmatic values. Although the main focus is on personal names and place names, we pay attention to different types of names, including autonyms and names for numbers and languages. A noteworthy conclusion is that in order to arrive at a satisfying description, we need to define a new grammatical category, viz. that of deproprial nouns.",Journal of African Languages and Linguistics
https://doi.org/10.1515/jall.2011.006,Saskia van Putten,Recent publications in African linguistics,2011,"Article Recent publications in African linguistics was published on June 1, 2011 in the journal Journal of African Languages and Linguistics (volume 32, issue 1).",Journal of African Languages and Linguistics
